specialty_name,disease_name,diagnosis_name,aliases,diagnostic_basis,key_symptoms,key_labs_or_tests,differential_diagnosis,diagnosis_relevance,diagnosis_relevance_label,reference_source,reference_url,agent_use
神经,ischemic stroke,ischemic stroke,cerebral infarction|transient ischemic attack|TIA,focal neurological deficit with vascular imaging or clinical stroke diagnosis,weakness|aphasia|facial droop|vision loss|ataxia,CT head|MRI brain|coagulation tests|glucose|vascular imaging,intracerebral hemorrhage|seizure|migraine|hypoglycemia,primary_specialty_disease,专科疾病诊断知识,AHA/ASA stroke guideline; Merck Manual,https://www.merckmanuals.com/professional/neurologic-disorders/stroke/ischemic-stroke,用于识别卒中诊断线索和抗栓治疗复核
神经,intracerebral hemorrhage,intracerebral hemorrhage,subarachnoid hemorrhage|nontraumatic intracranial hemorrhage,acute neurological deficit with CT or MRI evidence of bleeding,headache|vomiting|altered consciousness|focal deficit,CT head|INR|platelet count|blood pressure,ischemic stroke|trauma|brain tumor|hemorrhagic conversion,primary_specialty_disease,专科疾病诊断知识,AHA/ASA intracerebral hemorrhage guideline; Merck Manual,https://www.merckmanuals.com/professional/neurologic-disorders/stroke/intracerebral-hemorrhage,用于识别出血性神经疾病和抗凝抗血小板风险
神经,seizure disorder,seizure disorder,epilepsy|status epilepticus|convulsions,recurrent unprovoked seizures or acute seizure with compatible clinical evidence,convulsion|loss of consciousness|postictal confusion|tongue bite,EEG|glucose|sodium|calcium|drug levels,syncope|metabolic encephalopathy|psychogenic nonepileptic seizure,primary_specialty_disease,专科疾病诊断知识,ILAE epilepsy resources; MedlinePlus,https://medlineplus.gov/epilepsy.html,用于识别抗癫痫治疗目标和代谢诱因
神经,meningitis or encephalitis,meningitis or encephalitis,meningitis|encephalitis|meningoencephalitis,infection or inflammation of central nervous system supported by CSF or imaging,fever|neck stiffness|headache|altered mental status,CSF analysis|blood culture|CT or MRI|WBC,sepsis associated encephalopathy|stroke|drug toxicity,primary_specialty_disease,专科疾病诊断知识,IDSA meningitis guidance; Merck Manual,https://www.merckmanuals.com/professional/neurologic-disorders/meningitis/acute-bacterial-meningitis,用于识别中枢感染诊断线索和抗感染治疗风险
神经,Parkinson disease,Parkinson disease,parkinsonism|paralysis agitans,bradykinesia plus rest tremor rigidity or postural instability,rest tremor|rigidity|bradykinesia|gait instability,clinical neurologic exam|medication review,drug induced parkinsonism|essential tremor|normal pressure hydrocephalus,primary_specialty_disease,专科疾病诊断知识,Movement Disorder Society resources; Merck Manual,https://www.merckmanuals.com/professional/neurologic-disorders/movement-and-cerebellar-disorders/parkinson-disease,用于识别多巴胺能治疗知识和谵妄低血压风险
神经,dementia or delirium,dementia or delirium,Alzheimer disease|vascular dementia|acute confusional state,cognitive decline or acute attention fluctuation after excluding reversible causes,memory loss|confusion|agitation|inattention,cognitive testing|TSH|B12|infection workup|CT head,depression|metabolic encephalopathy|medication toxicity,primary_specialty_disease,专科疾病诊断知识,NIA dementia resources; Merck Manual,https://www.merckmanuals.com/professional/neurologic-disorders/delirium-and-dementia/dementia,用于识别认知障碍与镇静抗胆碱药物风险
神经,migraine,migraine,headache syndrome|migraine with aura,recurrent headache with migraine features and absence of secondary red flags,unilateral headache|photophobia|nausea|aura,neurologic exam|imaging if red flags,subarachnoid hemorrhage|meningitis|intracranial mass,primary_specialty_disease,专科疾病诊断知识,American Headache Society resources; MedlinePlus,https://medlineplus.gov/migraine.html,用于识别偏头痛治疗知识并排除危险头痛
神经,peripheral neuropathy,peripheral neuropathy,polyneuropathy|diabetic neuropathy|neuropathic pain,symmetric sensory symptoms or neuropathic pain with compatible exam,numbness|burning pain|weakness|paresthesia,glucose|B12|TSH|EMG,radiculopathy|spinal cord disease|vascular claudication,primary_specialty_disease,专科疾病诊断知识,American Academy of Neurology resources; Merck Manual,https://www.merckmanuals.com/professional/neurologic-disorders/peripheral-nervous-system-and-motor-unit-disorders/peripheral-neuropathy,用于识别神经病理痛和镇静药物风险
