specialty_name,standard_drug_name,drug_name,aliases,drug_class,disease_context,treatment_role,treatment_role_label,order_category,mechanism_or_function,major_cautions,reference_source,reference_url,agent_use
神经,levetiracetam,levetiracetam,keppra,antiepileptic,seizure|epilepsy|status epilepticus,disease_directed_therapy,疾病直接治疗,disease_directed,modulates synaptic vesicle protein SV2A to reduce seizure activity,renal dose and behavioral adverse effect review,RxNorm/ATC/DailyMed,https://dailymed.nlm.nih.gov/dailymed,作为公开药物功能知识进入候选药物解释，仍需结合诊断和风险规则复核
神经,phenytoin,phenytoin,dilantin,antiepileptic,seizure|epilepsy|status epilepticus,disease_directed_therapy,疾病直接治疗,disease_directed,blocks voltage gated sodium channels to stabilize neuronal membranes,drug level interaction hepatic and rash review,RxNorm/ATC/DailyMed,https://dailymed.nlm.nih.gov/dailymed,作为公开药物功能知识进入候选药物解释，仍需结合诊断和风险规则复核
神经,lacosamide,lacosamide,vimpat,antiepileptic,seizure|epilepsy,disease_directed_therapy,疾病直接治疗,disease_directed,enhances slow inactivation of voltage gated sodium channels,PR interval cardiac conduction and dizziness review,RxNorm/ATC/DailyMed,https://dailymed.nlm.nih.gov/dailymed,作为公开药物功能知识进入候选药物解释，仍需结合诊断和风险规则复核
神经,lamotrigine,lamotrigine,lamictal|lamotrig,antiepileptic,seizure|epilepsy|bipolar disorder,disease_directed_therapy,疾病直接治疗,disease_directed,inhibits sodium channels and reduces glutamate release,serious rash and titration review,RxNorm/ATC/DailyMed,https://dailymed.nlm.nih.gov/dailymed,作为公开药物功能知识进入候选药物解释，仍需结合诊断和风险规则复核
神经,topiramate,topiramate,topamax,antiepileptic,seizure|epilepsy|migraine,disease_directed_therapy,疾病直接治疗,disease_directed,modulates sodium channels GABA and glutamate activity,renal stones acidosis cognitive adverse effect review,RxNorm/ATC/DailyMed,https://dailymed.nlm.nih.gov/dailymed,作为公开药物功能知识进入候选药物解释，仍需结合诊断和风险规则复核
神经,valproate,valproate,valproic acid|divalproex,antiepileptic,seizure|epilepsy|migraine,disease_directed_therapy,疾病直接治疗,disease_directed,increases GABA activity and broad antiseizure effect,liver platelet pregnancy and ammonia review,RxNorm/ATC/DailyMed,https://dailymed.nlm.nih.gov/dailymed,作为公开药物功能知识进入候选药物解释，仍需结合诊断和风险规则复核
神经,gabapentin,gabapentin,neurontin,neuropathic pain agent,neuropathic pain|seizure,risk_modifying_therapy,风险控制治疗,risk_modifying,binds alpha 2 delta calcium channel subunit to reduce neuropathic signaling,renal dose sedation and fall risk review,RxNorm/ATC/DailyMed,https://dailymed.nlm.nih.gov/dailymed,作为公开药物功能知识进入候选药物解释，仍需结合诊断和风险规则复核
神经,baclofen,baclofen,,antispasticity agent,spasticity|multiple sclerosis|spinal cord disease,risk_modifying_therapy,风险控制治疗,risk_modifying,GABA B agonist reduces spinal excitatory transmission,sedation renal dose and withdrawal review,RxNorm/ATC/DailyMed,https://dailymed.nlm.nih.gov/dailymed,作为公开药物功能知识进入候选药物解释，仍需结合诊断和风险规则复核
神经,donepezil,donepezil,aricept,cholinesterase inhibitor,dementia|alzheimer disease,disease_directed_therapy,疾病直接治疗,disease_directed,inhibits acetylcholinesterase to improve cholinergic signaling,bradycardia syncope and GI adverse effect review,RxNorm/ATC/DailyMed,https://dailymed.nlm.nih.gov/dailymed,作为公开药物功能知识进入候选药物解释，仍需结合诊断和风险规则复核
神经,carbidopa levodopa,carbidopa levodopa,sinemet|levodopa,dopaminergic agent,parkinson disease,disease_directed_therapy,疾病直接治疗,disease_directed,replaces dopamine precursor while reducing peripheral metabolism,orthostasis hallucination dyskinesia review,RxNorm/ATC/DailyMed,https://dailymed.nlm.nih.gov/dailymed,作为公开药物功能知识进入候选药物解释，仍需结合诊断和风险规则复核
神经,alteplase,alteplase,tPA|rtPA,thrombolytic,acute ischemic stroke|pulmonary embolism,disease_directed_therapy,疾病直接治疗,disease_directed,converts plasminogen to plasmin and dissolves fibrin clot,strict bleeding contraindication and time window review,RxNorm/ATC/DailyMed,https://dailymed.nlm.nih.gov/dailymed,作为公开药物功能知识进入候选药物解释，仍需结合诊断和风险规则复核
神经,mannitol,mannitol,,osmotic agent,cerebral edema|intracranial hypertension,risk_modifying_therapy,风险控制治疗,risk_modifying,increases plasma osmolality to reduce cerebral edema,renal function serum osmolality and volume status review,RxNorm/ATC/DailyMed,https://dailymed.nlm.nih.gov/dailymed,作为公开药物功能知识进入候选药物解释，仍需结合诊断和风险规则复核
神经,memantine,memantine,namenda,NMDA receptor antagonist,dementia|alzheimer disease,disease_directed_therapy,疾病直接治疗,disease_directed,modulates glutamatergic NMDA receptor activity,renal dose dizziness and confusion review,RxNorm/ATC/DailyMed,https://dailymed.nlm.nih.gov/dailymed,作为公开药物功能知识进入候选药物解释，仍需结合诊断和风险规则复核
神经,sumatriptan,sumatriptan,imitrex,triptan,migraine,disease_directed_therapy,疾病直接治疗,disease_directed,5 HT1B 1D agonist causing cranial vasoconstriction and trigeminal inhibition,coronary disease stroke and serotonin syndrome review,RxNorm/ATC/DailyMed,https://dailymed.nlm.nih.gov/dailymed,作为公开药物功能知识进入候选药物解释，仍需结合诊断和风险规则复核
神经,carbamazepine,carbamazepine,tegretol,antiepileptic,trigeminal neuralgia|seizure|epilepsy,disease_directed_therapy,疾病直接治疗,disease_directed,blocks voltage gated sodium channels to reduce neuronal firing,hyponatremia drug interaction blood count and rash review,RxNorm/ATC/DailyMed,https://dailymed.nlm.nih.gov/dailymed,作为公开药物功能知识进入候选药物解释，仍需结合诊断和风险规则复核
神经,oxcarbazepine,oxcarbazepine,trileptal,antiepileptic,seizure|trigeminal neuralgia,disease_directed_therapy,疾病直接治疗,disease_directed,sodium channel blockade reduces neuronal excitability,hyponatremia rash and interaction review,RxNorm/ATC/DailyMed,https://dailymed.nlm.nih.gov/dailymed,作为公开药物功能知识进入候选药物解释，仍需结合诊断和风险规则复核
神经,pregabalin,pregabalin,lyrica,neuropathic pain agent,neuropathic pain|seizure adjunct,risk_modifying_therapy,风险控制治疗,risk_modifying,binds alpha 2 delta calcium channel subunit to reduce neuropathic signaling,renal dose sedation edema and fall risk review,RxNorm/ATC/DailyMed,https://dailymed.nlm.nih.gov/dailymed,作为公开药物功能知识进入候选药物解释，仍需结合诊断和风险规则复核
神经,duloxetine,duloxetine,cymbalta,SNRI,neuropathic pain|depression|chronic pain,risk_modifying_therapy,风险控制治疗,risk_modifying,serotonin norepinephrine reuptake inhibition modulates pain pathways,liver serotonin syndrome blood pressure and renal review,RxNorm/ATC/DailyMed,https://dailymed.nlm.nih.gov/dailymed,作为公开药物功能知识进入候选药物解释，仍需结合诊断和风险规则复核
神经,amitriptyline,amitriptyline,,tricyclic antidepressant,neuropathic pain|migraine prophylaxis,risk_modifying_therapy,风险控制治疗,risk_modifying,inhibits serotonin and norepinephrine reuptake with anticholinergic effects,QT anticholinergic delirium and overdose risk review,RxNorm/ATC/DailyMed,https://dailymed.nlm.nih.gov/dailymed,作为公开药物功能知识进入候选药物解释，仍需结合诊断和风险规则复核
神经,clonazepam,clonazepam,klonopin,benzodiazepine,seizure|myoclonus|anxiety,risk_modifying_therapy,风险控制治疗,risk_modifying,GABA A positive allosteric modulation reduces neuronal excitability,sedation respiratory depression delirium and dependence review,RxNorm/ATC/DailyMed,https://dailymed.nlm.nih.gov/dailymed,作为公开药物功能知识进入候选药物解释，仍需结合诊断和风险规则复核
神经,midazolam,midazolam,versed,benzodiazepine,status epilepticus|procedural sedation,risk_modifying_therapy,风险控制治疗,risk_modifying,GABA A positive allosteric modulation for acute seizure control,respiratory depression hypotension and sedation monitoring review,RxNorm/ATC/DailyMed,https://dailymed.nlm.nih.gov/dailymed,作为公开药物功能知识进入候选药物解释，仍需结合诊断和风险规则复核
神经,rasagiline,rasagiline,azilect,MAO B inhibitor,parkinson disease,disease_directed_therapy,疾病直接治疗,disease_directed,inhibits monoamine oxidase B to increase dopamine signaling,serotonin syndrome tyramine and interaction review,RxNorm/ATC/DailyMed,https://dailymed.nlm.nih.gov/dailymed,作为公开药物功能知识进入候选药物解释，仍需结合诊断和风险规则复核
神经,pramipexole,pramipexole,mirapex,dopamine agonist,parkinson disease|restless legs,disease_directed_therapy,疾病直接治疗,disease_directed,dopamine receptor agonist improves motor symptoms,orthostasis hallucination impulse control and renal dose review,RxNorm/ATC/DailyMed,https://dailymed.nlm.nih.gov/dailymed,作为公开药物功能知识进入候选药物解释，仍需结合诊断和风险规则复核
神经,botulinum toxin,botulinum toxin,onabotulinumtoxinA,neuromuscular blocker,spasticity|dystonia|chronic migraine,risk_modifying_therapy,风险控制治疗,risk_modifying,inhibits acetylcholine release at neuromuscular junction,weakness dysphagia and spread of toxin effect review,RxNorm/ATC/DailyMed,https://dailymed.nlm.nih.gov/dailymed,作为公开药物功能知识进入候选药物解释，仍需结合诊断和风险规则复核
神经,acetaminophen,acetaminophen,paracetamol|acetaminophen iv,analgesic antipyretic,supportive care|general inpatient care,supportive_or_symptomatic_therapy,支持/对症服务药物,symptom_support,central analgesic and antipyretic effect,liver dose and alcohol use review,RxNorm/ATC/DailyMed,https://dailymed.nlm.nih.gov/dailymed,作为支持治疗或住院通用药物功能知识，不单独作为疾病直接治疗证据
神经,ibuprofen,ibuprofen,,NSAID,supportive care|general inpatient care,supportive_or_symptomatic_therapy,支持/对症服务药物,symptom_support,inhibits cyclooxygenase and prostaglandin synthesis,renal bleeding heart failure and GI risk review,RxNorm/ATC/DailyMed,https://dailymed.nlm.nih.gov/dailymed,作为支持治疗或住院通用药物功能知识，不单独作为疾病直接治疗证据
神经,ketorolac,ketorolac,,NSAID,supportive care|general inpatient care,supportive_or_symptomatic_therapy,支持/对症服务药物,symptom_support,potent short term NSAID analgesic,renal bleeding GI ulcer and duration review,RxNorm/ATC/DailyMed,https://dailymed.nlm.nih.gov/dailymed,作为支持治疗或住院通用药物功能知识，不单独作为疾病直接治疗证据
神经,morphine,morphine,morphine sulfate,opioid analgesic,supportive care|general inpatient care,supportive_or_symptomatic_therapy,支持/对症服务药物,symptom_support,mu opioid receptor agonist for severe pain,respiratory depression delirium renal and constipation review,RxNorm/ATC/DailyMed,https://dailymed.nlm.nih.gov/dailymed,作为支持治疗或住院通用药物功能知识，不单独作为疾病直接治疗证据
神经,hydromorphone,hydromorphone,hydromorphone dilaudid|dilaudid,opioid analgesic,supportive care|general inpatient care,supportive_or_symptomatic_therapy,支持/对症服务药物,symptom_support,mu opioid receptor agonist for severe pain,respiratory depression delirium renal and constipation review,RxNorm/ATC/DailyMed,https://dailymed.nlm.nih.gov/dailymed,作为支持治疗或住院通用药物功能知识，不单独作为疾病直接治疗证据
神经,oxycodone,oxycodone,oxycodone immediate release,opioid analgesic,supportive care|general inpatient care,supportive_or_symptomatic_therapy,支持/对症服务药物,symptom_support,mu opioid receptor agonist for moderate to severe pain,respiratory depression delirium and constipation review,RxNorm/ATC/DailyMed,https://dailymed.nlm.nih.gov/dailymed,作为支持治疗或住院通用药物功能知识，不单独作为疾病直接治疗证据
神经,tramadol,tramadol,ultram,opioid analgesic,supportive care|general inpatient care,supportive_or_symptomatic_therapy,支持/对症服务药物,symptom_support,weak mu agonist and monoamine reuptake inhibition,seizure serotonin syndrome renal and delirium review,RxNorm/ATC/DailyMed,https://dailymed.nlm.nih.gov/dailymed,作为支持治疗或住院通用药物功能知识，不单独作为疾病直接治疗证据
神经,lorazepam,lorazepam,ativan,benzodiazepine,supportive care|general inpatient care,supportive_or_symptomatic_therapy,支持/对症服务药物,symptom_support,GABA A positive allosteric modulator,respiratory depression delirium fall and hepatic context review,RxNorm/ATC/DailyMed,https://dailymed.nlm.nih.gov/dailymed,作为支持治疗或住院通用药物功能知识，不单独作为疾病直接治疗证据
神经,haloperidol,haloperidol,,antipsychotic,supportive care|general inpatient care,supportive_or_symptomatic_therapy,支持/对症服务药物,symptom_support,D2 receptor antagonist for agitation or delirium,QT extrapyramidal and Parkinson disease review,RxNorm/ATC/DailyMed,https://dailymed.nlm.nih.gov/dailymed,作为支持治疗或住院通用药物功能知识，不单独作为疾病直接治疗证据
神经,ondansetron,ondansetron,zofran,antiemetic,supportive care|general inpatient care,supportive_or_symptomatic_therapy,支持/对症服务药物,symptom_support,5 HT3 receptor antagonist for nausea and vomiting,QT constipation and serotonin interaction review,RxNorm/ATC/DailyMed,https://dailymed.nlm.nih.gov/dailymed,作为支持治疗或住院通用药物功能知识，不单独作为疾病直接治疗证据
神经,prochlorperazine,prochlorperazine,,dopamine antagonist antiemetic,supportive care|general inpatient care,supportive_or_symptomatic_therapy,支持/对症服务药物,symptom_support,dopamine receptor antagonism for nausea and vomiting,QT extrapyramidal sedation and Parkinson disease review,RxNorm/ATC/DailyMed,https://dailymed.nlm.nih.gov/dailymed,作为支持治疗或住院通用药物功能知识，不单独作为疾病直接治疗证据
神经,metoclopramide,metoclopramide,,antiemetic prokinetic,supportive care|general inpatient care,supportive_or_symptomatic_therapy,支持/对症服务药物,symptom_support,dopamine antagonist and prokinetic effect,extrapyramidal tardive dyskinesia and renal dose review,RxNorm/ATC/DailyMed,https://dailymed.nlm.nih.gov/dailymed,作为支持治疗或住院通用药物功能知识，不单独作为疾病直接治疗证据
神经,senna,senna,sennosides,stimulant laxative,supportive care|general inpatient care,supportive_or_symptomatic_therapy,支持/对症服务药物,symptom_support,stimulates intestinal motility,constipation pattern electrolyte and chronic use review,RxNorm/ATC/DailyMed,https://dailymed.nlm.nih.gov/dailymed,作为支持治疗或住院通用药物功能知识，不单独作为疾病直接治疗证据
神经,docusate,docusate,docusate sodium,stool softener,supportive care|general inpatient care,supportive_or_symptomatic_therapy,支持/对症服务药物,symptom_support,surfactant stool softener for constipation,limited efficacy and bowel obstruction review,RxNorm/ATC/DailyMed,https://dailymed.nlm.nih.gov/dailymed,作为支持治疗或住院通用药物功能知识，不单独作为疾病直接治疗证据
神经,bisacodyl,bisacodyl,,stimulant laxative,supportive care|general inpatient care,supportive_or_symptomatic_therapy,支持/对症服务药物,symptom_support,stimulates colonic peristalsis,obstruction dehydration and electrolyte review,RxNorm/ATC/DailyMed,https://dailymed.nlm.nih.gov/dailymed,作为支持治疗或住院通用药物功能知识，不单独作为疾病直接治疗证据
神经,polyethylene glycol,polyethylene glycol,peg 3350|miralax,osmotic laxative,supportive care|general inpatient care,supportive_or_symptomatic_therapy,支持/对症服务药物,symptom_support,retains water in stool to improve bowel movement,obstruction dehydration and electrolyte review,RxNorm/ATC/DailyMed,https://dailymed.nlm.nih.gov/dailymed,作为支持治疗或住院通用药物功能知识，不单独作为疾病直接治疗证据
神经,simethicone,simethicone,,antiflatulent,supportive care|general inpatient care,supportive_or_symptomatic_therapy,支持/对症服务药物,symptom_support,reduces surface tension of gas bubbles,low systemic risk but symptom masking review,RxNorm/ATC/DailyMed,https://dailymed.nlm.nih.gov/dailymed,作为支持治疗或住院通用药物功能知识，不单独作为疾病直接治疗证据
神经,diphenhydramine,diphenhydramine,benadryl,antihistamine,supportive care|general inpatient care,supportive_or_symptomatic_therapy,支持/对症服务药物,symptom_support,H1 receptor antagonist with anticholinergic effects,delirium urinary retention glaucoma and sedation review,RxNorm/ATC/DailyMed,https://dailymed.nlm.nih.gov/dailymed,作为支持治疗或住院通用药物功能知识，不单独作为疾病直接治疗证据
神经,melatonin,melatonin,,sleep support,supportive care|general inpatient care,supportive_or_symptomatic_therapy,支持/对症服务药物,symptom_support,regulates circadian sleep signaling,sedation and interaction review,RxNorm/ATC/DailyMed,https://dailymed.nlm.nih.gov/dailymed,作为支持治疗或住院通用药物功能知识，不单独作为疾病直接治疗证据
神经,sodium chloride,sodium chloride,normal saline|0 9 sodium chloride|0 9 percent sodium chloride|ns,crystalloid fluid,supportive care|general inpatient care,general_inpatient_medication,住院通用服务药物,fluid_diluent_flush,isotonic sodium chloride for fluids flush or diluent,volume overload sodium chloride burden and heart failure review,RxNorm/ATC/DailyMed,https://dailymed.nlm.nih.gov/dailymed,作为支持治疗或住院通用药物功能知识，不单独作为疾病直接治疗证据
神经,dextrose,dextrose,d5|d10|d50|dextrose 5|dextrose 10|dextrose 50,glucose solution,supportive care|general inpatient care,general_inpatient_medication,住院通用服务药物,symptom_support,provides glucose calories or hypoglycemia rescue,hyperglycemia sodium dilution and extravasation review,RxNorm/ATC/DailyMed,https://dailymed.nlm.nih.gov/dailymed,作为支持治疗或住院通用药物功能知识，不单独作为疾病直接治疗证据
神经,lactated ringer,lactated ringer,lactated ringers|ringer,balanced crystalloid,supportive care|general inpatient care,general_inpatient_medication,住院通用服务药物,fluid_diluent_flush,balanced crystalloid fluid for resuscitation,potassium calcium liver and volume status review,RxNorm/ATC/DailyMed,https://dailymed.nlm.nih.gov/dailymed,作为支持治疗或住院通用药物功能知识，不单独作为疾病直接治疗证据
神经,sterile water,sterile water,sw,diluent,supportive care|general inpatient care,general_inpatient_medication,住院通用服务药物,fluid_diluent_flush,sterile diluent for medication preparation,not for direct IV infusion without tonicity review,RxNorm/ATC/DailyMed,https://dailymed.nlm.nih.gov/dailymed,作为支持治疗或住院通用药物功能知识，不单独作为疾病直接治疗证据
神经,heparin flush,heparin flush,heparin lock flush|heparin catheter flush,line flush,supportive care|general inpatient care,general_inpatient_medication,住院通用服务药物,fluid_diluent_flush,low dose heparin for catheter patency,bleeding HIT and duplicate anticoagulation review,RxNorm/ATC/DailyMed,https://dailymed.nlm.nih.gov/dailymed,作为支持治疗或住院通用药物功能知识，不单独作为疾病直接治疗证据
神经,influenza vaccine,influenza vaccine,flu vaccine|influenza vaccine quadrivalent,vaccine,supportive care|general inpatient care,general_inpatient_medication,住院通用服务药物,prophylaxis_prevention,preventive immunization against influenza,allergy acute illness and immunization status review,RxNorm/ATC/DailyMed,https://dailymed.nlm.nih.gov/dailymed,作为支持治疗或住院通用药物功能知识，不单独作为疾病直接治疗证据
神经,potassium chloride,potassium chloride,potassium chloride replacement,electrolyte replacement,supportive care|general inpatient care,supportive_or_symptomatic_therapy,支持/对症服务药物,nutrition_electrolyte_metabolic,repletes potassium deficit,hyperkalemia renal function infusion rate and ECG review,RxNorm/ATC/DailyMed,https://dailymed.nlm.nih.gov/dailymed,作为支持治疗或住院通用药物功能知识，不单独作为疾病直接治疗证据
神经,magnesium sulfate,magnesium sulfate,,electrolyte replacement,supportive care|general inpatient care,supportive_or_symptomatic_therapy,支持/对症服务药物,nutrition_electrolyte_metabolic,repletes magnesium and stabilizes neuromuscular excitability,renal function hypotension and respiratory depression review,RxNorm/ATC/DailyMed,https://dailymed.nlm.nih.gov/dailymed,作为支持治疗或住院通用药物功能知识，不单独作为疾病直接治疗证据
神经,calcium gluconate,calcium gluconate,,electrolyte replacement,supportive care|general inpatient care,supportive_or_symptomatic_therapy,支持/对症服务药物,nutrition_electrolyte_metabolic,repletes calcium and stabilizes myocardium in selected electrolyte emergencies,extravasation calcium level and digoxin caution review,RxNorm/ATC/DailyMed,https://dailymed.nlm.nih.gov/dailymed,作为支持治疗或住院通用药物功能知识，不单独作为疾病直接治疗证据
神经,ferrous sulfate,ferrous sulfate,iron sulfate,iron supplement,supportive care|general inpatient care,supportive_or_symptomatic_therapy,支持/对症服务药物,nutrition_support,oral iron replacement for iron deficiency,constipation GI irritation and iron overload review,RxNorm/ATC/DailyMed,https://dailymed.nlm.nih.gov/dailymed,作为支持治疗或住院通用药物功能知识，不单独作为疾病直接治疗证据
神经,folic acid,folic acid,folate,vitamin supplement,supportive care|general inpatient care,supportive_or_symptomatic_therapy,支持/对症服务药物,nutrition_support,folate replacement for deficiency or anemia,masking B12 deficiency review,RxNorm/ATC/DailyMed,https://dailymed.nlm.nih.gov/dailymed,作为支持治疗或住院通用药物功能知识，不单独作为疾病直接治疗证据
神经,thiamine,thiamine,vitamin B1,vitamin supplement,supportive care|general inpatient care,supportive_or_symptomatic_therapy,支持/对症服务药物,nutrition_support,vitamin B1 replacement in malnutrition or alcohol use,low systemic risk but timing before glucose in deficiency context review,RxNorm/ATC/DailyMed,https://dailymed.nlm.nih.gov/dailymed,作为支持治疗或住院通用药物功能知识，不单独作为疾病直接治疗证据
神经,multivitamin,multivitamin,multivitamins,vitamin supplement,supportive care|general inpatient care,supportive_or_symptomatic_therapy,支持/对症服务药物,nutrition_support,general vitamin supplementation,renal fat soluble vitamin and duplicate therapy review,RxNorm/ATC/DailyMed,https://dailymed.nlm.nih.gov/dailymed,作为支持治疗或住院通用药物功能知识，不单独作为疾病直接治疗证据
神经,albumin,albumin,human albumin,colloid fluid,supportive care|general inpatient care,supportive_or_symptomatic_therapy,支持/对症服务药物,symptom_support,increases plasma oncotic pressure and expands intravascular volume,volume overload allergy and indication review,RxNorm/ATC/DailyMed,https://dailymed.nlm.nih.gov/dailymed,作为支持治疗或住院通用药物功能知识，不单独作为疾病直接治疗证据
神经,pantoprazole,pantoprazole,protonix,acid suppression,supportive care|general inpatient care,supportive_or_symptomatic_therapy,支持/对症服务药物,prophylaxis_prevention,proton pump inhibition for stress ulcer prophylaxis,C difficile magnesium and indication review,RxNorm/ATC/DailyMed,https://dailymed.nlm.nih.gov/dailymed,作为支持治疗或住院通用药物功能知识，不单独作为疾病直接治疗证据
神经,famotidine,famotidine,pepcid,H2 receptor antagonist,supportive care|general inpatient care,supportive_or_symptomatic_therapy,支持/对症服务药物,prophylaxis_prevention,H2 receptor blockade reduces gastric acid secretion,renal dose delirium and QT review,RxNorm/ATC/DailyMed,https://dailymed.nlm.nih.gov/dailymed,作为支持治疗或住院通用药物功能知识，不单独作为疾病直接治疗证据
神经,omeprazole,omeprazole,prilosec,proton pump inhibitor,supportive care|general inpatient care,supportive_or_symptomatic_therapy,支持/对症服务药物,prophylaxis_prevention,proton pump inhibition suppresses gastric acid secretion,C difficile magnesium B12 and interaction review,RxNorm/ATC/DailyMed,https://dailymed.nlm.nih.gov/dailymed,作为支持治疗或住院通用药物功能知识，不单独作为疾病直接治疗证据
