specialty_name,standard_drug_name,drug_name,aliases,drug_class,disease_context,treatment_role,treatment_role_label,order_category,mechanism_or_function,major_cautions,reference_source,reference_url,agent_use
神经,naloxone,naloxone,narcan,opioid antagonist,supportive care|general inpatient care,supportive_or_symptomatic_therapy,支持/对症服务药物,emergency_rescue,competitive opioid receptor antagonist reverses opioid toxicity,withdrawal recurrent sedation and monitoring review,RxNorm/ATC/DailyMed,https://dailymed.nlm.nih.gov/dailymed,作为支持治疗或住院通用药物功能知识，不单独作为疾病直接治疗证据
神经,flumazenil,flumazenil,,benzodiazepine antagonist,supportive care|general inpatient care,supportive_or_symptomatic_therapy,支持/对症服务药物,emergency_rescue,benzodiazepine receptor antagonist reverses selected benzodiazepine effects,seizure risk chronic benzodiazepine use and monitoring review,RxNorm/ATC/DailyMed,https://dailymed.nlm.nih.gov/dailymed,作为支持治疗或住院通用药物功能知识，不单独作为疾病直接治疗证据
神经,epinephrine,epinephrine,adrenaline,adrenergic agonist,supportive care|general inpatient care,supportive_or_symptomatic_therapy,支持/对症服务药物,emergency_rescue,alpha and beta agonist supports anaphylaxis or cardiac arrest response,arrhythmia ischemia and extravasation review,RxNorm/ATC/DailyMed,https://dailymed.nlm.nih.gov/dailymed,作为支持治疗或住院通用药物功能知识，不单独作为疾病直接治疗证据
神经,diphenoxylate atropine,diphenoxylate atropine,lomotil,antidiarrheal,supportive care|general inpatient care,supportive_or_symptomatic_therapy,支持/对症服务药物,symptom_support,opioid antidiarrheal plus anticholinergic reduces intestinal motility,ileus infectious diarrhea delirium and anticholinergic review,RxNorm/ATC/DailyMed,https://dailymed.nlm.nih.gov/dailymed,作为支持治疗或住院通用药物功能知识，不单独作为疾病直接治疗证据
神经,loperamide,loperamide,imodium,antidiarrheal,supportive care|general inpatient care,supportive_or_symptomatic_therapy,支持/对症服务药物,symptom_support,peripheral opioid receptor agonist slows intestinal transit,infectious colitis ileus and QT with misuse review,RxNorm/ATC/DailyMed,https://dailymed.nlm.nih.gov/dailymed,作为支持治疗或住院通用药物功能知识，不单独作为疾病直接治疗证据
神经,guaifenesin,guaifenesin,,expectorant,supportive care|general inpatient care,supportive_or_symptomatic_therapy,支持/对症服务药物,symptom_support,expectorant helps loosen airway secretions,hydration status and symptom masking review,RxNorm/ATC/DailyMed,https://dailymed.nlm.nih.gov/dailymed,作为支持治疗或住院通用药物功能知识，不单独作为疾病直接治疗证据
神经,benzonatate,benzonatate,tessalon,antitussive,supportive care|general inpatient care,supportive_or_symptomatic_therapy,支持/对症服务药物,symptom_support,peripheral anesthetic effect reduces cough reflex,swallowing whole overdose and mental status review,RxNorm/ATC/DailyMed,https://dailymed.nlm.nih.gov/dailymed,作为支持治疗或住院通用药物功能知识，不单独作为疾病直接治疗证据
神经,lidocaine patch,lidocaine patch,lidocaine 5% patch,local anesthetic,supportive care|general inpatient care,supportive_or_symptomatic_therapy,支持/对症服务药物,symptom_support,local sodium channel blockade reduces focal pain,skin reaction systemic toxicity and duplicate local anesthetic review,RxNorm/ATC/DailyMed,https://dailymed.nlm.nih.gov/dailymed,作为支持治疗或住院通用药物功能知识，不单独作为疾病直接治疗证据
神经,lidocaine,lidocaine,1% lidocaine|lidocaine injection,local anesthetic,supportive care|general inpatient care,general_inpatient_medication,住院通用服务药物,procedure_or_nursing,local sodium channel blockade for procedural anesthesia,systemic toxicity arrhythmia dose and allergy review,RxNorm/ATC/DailyMed,https://dailymed.nlm.nih.gov/dailymed,作为支持治疗或住院通用药物功能知识，不单独作为疾病直接治疗证据
神经,chlorhexidine,chlorhexidine,,antiseptic,supportive care|general inpatient care,general_inpatient_medication,住院通用服务药物,procedure_or_nursing,topical antiseptic reduces skin microbial burden,skin irritation allergy and mucosal exposure review,RxNorm/ATC/DailyMed,https://dailymed.nlm.nih.gov/dailymed,作为支持治疗或住院通用药物功能知识，不单独作为疾病直接治疗证据
神经,povidone iodine,povidone iodine,betadine,antiseptic,supportive care|general inpatient care,general_inpatient_medication,住院通用服务药物,procedure_or_nursing,iodine antiseptic for skin preparation,iodine allergy thyroid and skin irritation review,RxNorm/ATC/DailyMed,https://dailymed.nlm.nih.gov/dailymed,作为支持治疗或住院通用药物功能知识，不单独作为疾病直接治疗证据
神经,nystatin,nystatin,nystatin oral suspension,antifungal,supportive care|general inpatient care,supportive_or_symptomatic_therapy,支持/对症服务药物,symptom_support,topical polyene antifungal for oral candidiasis,swallowing local irritation and systemic infection mismatch review,RxNorm/ATC/DailyMed,https://dailymed.nlm.nih.gov/dailymed,作为支持治疗或住院通用药物功能知识，不单独作为疾病直接治疗证据
神经,fluconazole,fluconazole,diflucan,azole antifungal,supportive care|general inpatient care,supportive_or_symptomatic_therapy,支持/对症服务药物,symptom_support,azole antifungal inhibits fungal ergosterol synthesis,liver QT drug interaction and renal dose review,RxNorm/ATC/DailyMed,https://dailymed.nlm.nih.gov/dailymed,作为支持治疗或住院通用药物功能知识，不单独作为疾病直接治疗证据
神经,insulin regular,insulin regular,regular insulin,glucose management,supportive care|general inpatient care,supportive_or_symptomatic_therapy,支持/对症服务药物,nutrition_electrolyte_metabolic,short acting insulin lowers glucose in correction or inpatient protocols,hypoglycemia potassium and nutrition timing review,RxNorm/ATC/DailyMed,https://dailymed.nlm.nih.gov/dailymed,作为支持治疗或住院通用药物功能知识，不单独作为疾病直接治疗证据
神经,glucagon,glucagon,,glucose rescue,supportive care|general inpatient care,supportive_or_symptomatic_therapy,支持/对症服务药物,nutrition_electrolyte_metabolic,raises glucose through hepatic glycogenolysis and gluconeogenesis,nausea glycogen depletion and insulinoma context review,RxNorm/ATC/DailyMed,https://dailymed.nlm.nih.gov/dailymed,作为支持治疗或住院通用药物功能知识，不单独作为疾病直接治疗证据
神经,sodium bicarbonate,sodium bicarbonate,,alkalinizing agent,supportive care|general inpatient care,supportive_or_symptomatic_therapy,支持/对症服务药物,nutrition_electrolyte_metabolic,provides bicarbonate buffer for selected acidosis or alkalinization contexts,sodium load alkalosis and volume overload review,RxNorm/ATC/DailyMed,https://dailymed.nlm.nih.gov/dailymed,作为支持治疗或住院通用药物功能知识，不单独作为疾病直接治疗证据
神经,phosphate replacement,phosphate replacement,potassium phosphate|sodium phosphate,electrolyte replacement,supportive care|general inpatient care,supportive_or_symptomatic_therapy,支持/对症服务药物,nutrition_electrolyte_metabolic,repletes phosphate deficit,calcium potassium sodium renal and infusion monitoring review,RxNorm/ATC/DailyMed,https://dailymed.nlm.nih.gov/dailymed,作为支持治疗或住院通用药物功能知识，不单独作为疾病直接治疗证据
神经,zinc sulfate,zinc sulfate,,trace element supplement,supportive care|general inpatient care,supportive_or_symptomatic_therapy,支持/对症服务药物,nutrition_support,zinc replacement supports nutrition and wound healing,nausea copper deficiency and dosing review,RxNorm/ATC/DailyMed,https://dailymed.nlm.nih.gov/dailymed,作为支持治疗或住院通用药物功能知识，不单独作为疾病直接治疗证据
神经,ascorbic acid,ascorbic acid,vitamin C,vitamin supplement,supportive care|general inpatient care,supportive_or_symptomatic_therapy,支持/对症服务药物,nutrition_support,vitamin C replacement supports deficiency and wound healing,renal stones and high dose review,RxNorm/ATC/DailyMed,https://dailymed.nlm.nih.gov/dailymed,作为支持治疗或住院通用药物功能知识，不单独作为疾病直接治疗证据
神经,enteral nutrition,enteral nutrition,feeding formula|tube feeding,nutrition product,supportive care|general inpatient care,general_inpatient_medication,住院通用服务药物,nutrition_support,provides calories protein and micronutrients through enteral route,aspiration glucose electrolyte and refeeding risk review,RxNorm/ATC/DailyMed,https://dailymed.nlm.nih.gov/dailymed,作为支持治疗或住院通用药物功能知识，不单独作为疾病直接治疗证据
神经,parenteral nutrition,parenteral nutrition,TPN|total parenteral nutrition,nutrition product,supportive care|general inpatient care,general_inpatient_medication,住院通用服务药物,nutrition_support,provides intravenous macronutrients and micronutrients when enteral route inadequate,line infection glucose liver and electrolyte review,RxNorm/ATC/DailyMed,https://dailymed.nlm.nih.gov/dailymed,作为支持治疗或住院通用药物功能知识，不单独作为疾病直接治疗证据
