specialty_name,disease_name,diagnosis_name,aliases,diagnostic_basis,key_symptoms,key_labs_or_tests,differential_diagnosis,diagnosis_relevance,diagnosis_relevance_label,reference_source,reference_url,agent_use
心血管,acute coronary syndrome,acute coronary syndrome,acute myocardial infarction|unstable angina|NSTEMI|STEMI,ischemic symptoms with ECG change or troponin rise,chest pain|dyspnea|diaphoresis|nausea,troponin|ECG|CK-MB|echocardiography,aortic dissection|pulmonary embolism|pericarditis|noncardiac chest pain,primary_specialty_disease,专科疾病诊断知识,AHA/ACC ACS guidance; Merck Manual,https://www.merckmanuals.com/professional/cardiovascular-disorders/coronary-artery-disease/acute-coronary-syndromes,用于识别急性冠脉综合征并提示抗血小板抗凝和出血风险复核
心血管,stable coronary artery disease,stable coronary artery disease,chronic coronary syndrome|coronary atherosclerosis|angina,exertional ischemic symptoms or known coronary artery disease with objective ischemia,exertional chest discomfort|dyspnea|fatigue,ECG|stress testing|coronary angiography|lipid profile,acute coronary syndrome|GERD|musculoskeletal pain,primary_specialty_disease,专科疾病诊断知识,AHA/ACC chronic coronary disease guideline; Merck Manual,https://www.merckmanuals.com/professional/cardiovascular-disorders/coronary-artery-disease/coronary-artery-disease,用于识别慢性冠脉病治疗目标和抗血小板调脂知识
心血管,heart failure,heart failure,congestive heart failure|systolic heart failure|diastolic heart failure,typical congestion symptoms plus objective cardiac dysfunction evidence,dyspnea|edema|orthopnea|fatigue,BNP|NT-proBNP|echocardiography|chest radiograph|creatinine,COPD exacerbation|renal failure|pneumonia|pulmonary embolism,primary_specialty_disease,专科疾病诊断知识,AHA/ACC/HFSA heart failure guideline; Merck Manual,https://www.merckmanuals.com/professional/cardiovascular-disorders/heart-failure/heart-failure-hf,用于识别心衰相关治疗目标和容量管理风险
心血管,atrial fibrillation,atrial fibrillation,atrial flutter|unspecified atrial fibrillation,irregular rhythm with ECG evidence of atrial fibrillation,palpitations|syncope|dyspnea|fatigue,ECG|INR|electrolytes|TSH,sinus tachycardia|supraventricular tachycardia|atrial flutter,primary_specialty_disease,专科疾病诊断知识,AHA/ACC atrial fibrillation guideline; MedlinePlus,https://medlineplus.gov/atrialfibrillation.html,用于识别抗凝和心率控制相关诊疗知识
心血管,hypertension,hypertension,essential hypertension|hypertensive chronic kidney disease,persistent elevated blood pressure or documented hypertensive disease,headache|chest discomfort|often asymptomatic,blood pressure|creatinine|potassium|urinalysis,secondary hypertension|pain related blood pressure elevation|white coat hypertension,primary_specialty_disease,专科疾病诊断知识,ACC/AHA hypertension guideline; MedlinePlus,https://medlineplus.gov/highbloodpressure.html,用于识别降压治疗目标和肾功能电解质复核
心血管,valvular heart disease,valvular heart disease,aortic stenosis|mitral regurgitation|aortic regurgitation|mitral stenosis,murmur or symptoms with echocardiographic valve abnormality,dyspnea|syncope|chest pain|edema,echocardiography|ECG|BNP|chest radiograph,heart failure|cardiomyopathy|pulmonary hypertension,primary_specialty_disease,专科疾病诊断知识,AHA/ACC valvular heart disease guideline; Merck Manual,https://www.merckmanuals.com/professional/cardiovascular-disorders/valvular-disorders/overview-of-cardiac-valvular-disorders,用于识别瓣膜病导致的容量和抗凝相关风险
心血管,infective endocarditis,infective endocarditis,endocarditis|acute bacterial endocarditis,persistent bacteremia with vegetation or compatible Duke criteria,fever|new murmur|embolic signs|chills,blood culture|echocardiography|CBC|CRP,sepsis|valvular degeneration|noninfective endocarditis,primary_specialty_disease,专科疾病诊断知识,AHA infective endocarditis statement; Merck Manual,https://www.merckmanuals.com/professional/cardiovascular-disorders/endocarditis/infective-endocarditis,用于识别感染性心内膜炎和抗感染抗凝复核场景
心血管,aortic aneurysm or dissection,aortic aneurysm or dissection,aortic aneurysm|aortic dissection|abdominal aortic aneurysm,acute tearing pain or aneurysm imaging evidence with vascular risk context,severe chest pain|back pain|syncope|hypotension,CT angiography|echocardiography|blood pressure|hemoglobin,acute coronary syndrome|pulmonary embolism|musculoskeletal pain,primary_specialty_disease,专科疾病诊断知识,ACC/AHA aortic disease guideline; Merck Manual,https://www.merckmanuals.com/professional/cardiovascular-disorders/aortic-disorders/aortic-dissection,用于识别主动脉急症和抗凝降压风险复核
